Date tweeted,username,display_name,Tweets,Number_of_Likes,Number_retweets,Source_of_Tweet,number_of_followers,location
2023-01-02 12:11:29+00:00,mcebiscoocom,Shadrack Ebimodenghan Ebisco,"Akinyemi To OBJ On Obi’s Endorsement: You’re Part Of Nigeria’s https://t.co/AMgFC2IquT 

Cubana Thiefnubu Atiku in 2019 Jonathan Seyi Vibez Sack Davido #PiggyVest African Giant Aboubakar Yorubas #BurnaBoy Tinubu and Atiku Copywriting Graham Potter Adekunle Gold Abeokuta",0,0,Twitter Web App,2428,Nigeria
2023-01-02 12:11:09+00:00,vanguardngrnews,Vanguard Newspapers,"Obasanjo has crashed Atiku, Tinubu’s presidential bid with Obi’s endorsement – Udeogaranya https://t.co/hHFoDxgNib",19,4,Jetpack.com,4076261,Nigeria
2023-01-02 12:11:08+00:00,OnwardNG,Onward Nigeria,"Today in the News: Atiku, Tinubu kick as Obasanjo endorses Peter Obi  https://t.co/HhY1SrS0aW https://t.co/aUGMQ9nuXO",0,0,dlvr.it,90985,onwardng@gmail.com
2023-01-02 12:11:02+00:00,Ogbonnaya3838,Ogbonnaya okwara,@U_Rochas Like Atiku expand his CV every 4years and go back to Dubai???,0,0,Twitter for Android,543,
2023-01-02 12:10:56+00:00,IsaAshiruKudan,Rt. Hon. Isa Ashiru,"I’m currently at Arewa House Kaduna alongside my dear wife, Hajiya Ramla Ashiru, the former Governor of Kaduna State, Sen. Ahmed Makarfi and other members of the Campaign council for a strategic meeting with the Kaduna Muslim Women Mobilization for Atiku and Ashiru. https://t.co/x7XIl09Pfx",13,4,Twitter for iPhone,7985,"Kaduna, Nigeria"
2023-01-02 12:10:52+00:00,uty_onuk,De' 'Mikano' Mayor,"@ItoroIsaac6 This text is sponsored by the same people that brought ""The money Atiku stole can feed 400m Nigerians for 300years"". All balderdash!",0,0,Twitter for Android,2659,UnDiaspora
2023-01-02 12:10:42+00:00,hadjiambali,Abu Abdillah,@mindset_tweet @ChinonsoCharl15 why didn't OBJ protect Atiku's vote in 2019 since you claimed it was rigged?,0,0,Twitter for Android,1304,"Lagos,Nigeria"
2023-01-02 12:10:32+00:00,UgoGod63,A Q U I L A D E I,@firstladyship @atiku @IAOkowa Deception and desperation.,0,0,Twitter for Android,142,Lagos
2023-01-02 12:10:32+00:00,controversy_rep,ControversyRep,It’s paining them that OBJ didn’t choose Tinubu the drug dealer or Atiku the renowned thief of the Nigerian treasury. https://t.co/9hVp5Nlb8n,0,0,Twitter for iPhone,92,Nigeria
